"","user","type"
"2152","Life after Hayne starts for Kangaroos: Kangaroos captain Cameron Smith is still getting his h... #ausnews #uavaus","news"
"2153","WA Government to legislate for expanded City of Perth: The State Government has signalled it ... #ausnews #uavaus","news"
"2154","Rural communities fear for health services amid budget cuts: The body that represents rural d... #ausnews #uavaus","news"
"2155","Case of jailed mentally ill man to be reviewed: The imprisonment of a mentally impaired Abori... #ausnews #uavaus","news"
"2156","Jehovah's Witness conference and Caulfield Cup collide: Melbourne hotels are almost fully boo... #ausnews #uavaus","news"
"2157","Legal observers to patrol Brisbane during G20 summit: Independent legal observers will walk B... #ausnews #uavaus","news"
"2158","More money needed for SA courts: barristers: A group representing 250 barristers in South Aus... #ausnews #uavaus","news"
"2159","Church abuse victim says last decade 'a living hell': A man who was sexually abused by a Suns... #ausnews #uavaus","news"
"2160","Minister rejects push to allow pet rabbits in Qld: The Queensland Government has rejected cal... #ausnews #uavaus","news"
"2161","Diamonds ready for improved, bitter England: The Diamonds are preparing to face an improving ... #ausnews #uavaus","news"
"2162","Liberal Vasse win almost certain: Antony Green: The Liberal Party is almost certain to win to... #ausnews #uavaus","news"
"2163","WA into one-day cup cricket final: Western Australia beat South Australia by four wickets to ... #ausnews #uavaus","news"
"2164","Men jailed in WA over drugs hidden in ceramic tiles: Three men involved in the importation to... #ausnews #uavaus","news"
"2165","Chemist who supplied Dank guilty of misconduct: A chemist who supplied supplements to Stephen... #ausnews #uavaus","news"
"2166","Casuarina candidates in their own words: The ABC asked the seven candidates standing in the C... #ausnews #uavaus","news"
"2167","Alex McKinnon leaves hospital to continue rehab: Alex McKinnon has been released from hospita... #ausnews #uavaus","news"
"2168","Fiery car crash on Hume Highway disrupts traffic: A crash that has left two cars a smoking me... #ausnews #uavaus","news"
"2169","Canberra restaurateur admits trying to import cocaine: A high-profile Canberra restaurateur h... #ausnews #uavaus","news"
"2170","Parties go all out to win Casuarina: It is a by-election the Northern Territory's ruling Coun... #ausnews #uavaus","news"
"2171","All Blacks will have an axe to grind, say Wallabies: Wallabies lock Sam Carter is expecting t... #ausnews #uavaus","news"
"2172","Jokowi to hike Indonesian fuel prices: adviser: Indonesia's president-elect will hike fuel pr... #ausnews #uavaus","news"
"2173","WA Premier vows to expand CCC powers: The Western Australian Premier has flagged a renewed pu... #ausnews #uavaus","news"
"2174","US nurse with Ebola appears in emotional YouTube clip: The first health care worker infected ... #ausnews #uavaus","news"
"2175","Cuts force nurses to work more 17-hour shifts: union: Tasmanian nurses claim working a 17-hou... #ausnews #uavaus","news"
"2176","Fire at Revesby auto parts factory contained: More than 100 firefighters have contained a lar... #ausnews #uavaus","news"
"2177","Nepal avalanche survivors speak out as search continues: Survivors' stories are starting to e... #ausnews #uavaus","news"
"2178","Police officer denies obligation to report Church abuse: A police officer who sat on a Cathol... #ausnews #uavaus","news"
"2179","Resume Middle East talks to combat extremism: Kerry: John Kerry calls for a resumption of the... #ausnews #uavaus","news"
"2180","Rapid test for shellfish toxins developed by scientists: Scientists in Hobart believe fish fa... #ausnews #uavaus","news"
"2181","Family wants answers from inquest into soldiers' deaths: The brother of an Australian soldier... #ausnews #uavaus","news"
"2182","Labor urges police to investigate bestiality allegations: Victorian Labor will ask police to ... #ausnews #uavaus","news"
"2183","Ishikawa blast sends Giants to World Series: Travis Ishikawa smashed a three-run home run to ... #ausnews #uavaus","news"
"2184","A-League derby won't turn nasty: Popovic: Wanderers coach Tony Popovic is confident Saturday'... #ausnews #uavaus","news"
"2185","Costco's liquor licence request knocked back by court: American retail giant Costco has hit a... #ausnews #uavaus","news"
"2186","Bombers deserve better, parliamentary inquiry told: A parliamentary inquiry in Canberra has h... #ausnews #uavaus","news"
"2187","Child sex case against ADF Bishop adjourned: The case against Australian Defence Force Bishop... #ausnews #uavaus","news"
"2188","Ebola threat prompts opening of Qld emergency coordination centre: Queensland Health has acti... #ausnews #uavaus","news"
"2189","Aussie riders tumble during Australian Grand Prix practice: Australian riders have found it t... #ausnews #uavaus","news"
"2190","NSW bushfire survivors reflect on long road to recovery: The anniversary of the Blue Mountain... #ausnews #uavaus","news"
"2191","Plan to overhaul SA health system released: The State Government has unveiled a plan which it... #ausnews #uavaus","news"
"2192","Lehmann rewarded with contract extension: Ashes-winning coach Darren Lehmann has been handed ... #ausnews #uavaus","news"
"2193","US sending reservists to join fight against Ebola in West Africa: US president Barack Obama w... #ausnews #uavaus","news"
"2194","Virgin agrees to pay $1 for remainder of Tiger Australia: Virgin has agreed to pay $1 to comp... #ausnews #uavaus","news"
"2195","Australia claims rugby's first 'own try' after ref howler: The NRC is claiming the world's fi... #ausnews #uavaus","news"
"2196","Newman's chief of staff accused of 'abusive rant': A senior staffer in the Queensland Premier... #ausnews #uavaus","news"
"2197","NFL franchises showing big interest in Hayne: manager: Jarryd Hayne's manager says NFL franch... #ausnews #uavaus","news"
"2198","Alleged copper thief found dead in Melbourne roof: A man who plunged to his death in an aband... #ausnews #uavaus","news"
"2199","Australian miner found dead in Uganda hotel: A West Australian mine worker travelling home fr... #ausnews #uavaus","news"
"2200","Committee recommends passing of Foreign Fighters Bill: A federal parliamentary committee has ... #ausnews #uavaus","news"
"2201","Hong Kong police remove barricades at Mong Kok site: Hong Kong police have cleared a pro-demo... #ausnews #uavaus","news"
"2202","Climate change forcing rethink on fire risk: RFS chief: Climate change is having an impact on... #ausnews #uavaus","news"
"2203","Ramped-up air strikes stall IS advance on Kobane: Two days of heavy air strikes by US warplan... #ausnews #uavaus","news"
"2204","Shareholder activists target long-serving and over-committed directors: Big proxy advisory fi... #ausnews #uavaus","news"
"2205","Joan Rivers died of oxygen deprivation to brain, autopsy reveals: Comedian Joan Rivers died o... #ausnews #uavaus","news"
"2206","Scientists discover link between viral infections, autoimmunity: A previously unknown link be... #ausnews #uavaus","news"
"2207","Underworld queen Persephone uncovered in Greek myth mosaic: A mosaic uncovered in an ancient ... #ausnews #uavaus","news"
"2208","Police, Customs officers raid Brisbane properties: Police and Customs and Border Control offi... #ausnews #uavaus","news"
"2209","Wade suspended for breaking changing room window: Matthew Wade has been suspended for one mat... #ausnews #uavaus","news"
"2210","Grocery lobby welcomes ACCC court action against Coles: The Australian Food and Grocery Counc... #ausnews #uavaus","news"
"2211","Cycle of life on display in Blue Mountains bushfire exhibition: An exhibition of photos and a... #ausnews #uavaus","news"
"2212","Mob uses bricks to attack Perth fast food outlet: Police are trying to determine what sparked... #ausnews #uavaus","news"
"2213","Explained: What makes the Middle East a witch's brew?: Do you understand what's happening in ... #ausnews #uavaus","news"
"2214","Australia asks Japan for help to build submarine fleet: Australia's Defence Minister has requ... #ausnews #uavaus","news"
"2215","Girl bitten by shark at NSW beach: A 13-year-old girl has been bitten on the calf and foot by... #ausnews #uavaus","news"
"2216","Death toll rises after avalanche on Nepal trekking route: Mountain rescue teams are still hun... #ausnews #uavaus","news"
"2217","McDowell suffers defeat at World Match Play Championship: Defending champion Graeme McDowell ... #ausnews #uavaus","news"
"2218","Doolan notches ton against Pakistan A in tour match: Alex Doolan scored a timely century as A... #ausnews #uavaus","news"
"2219","Three men charged over Sydney brothel siege: Three men will face court today after a siege at... #ausnews #uavaus","news"
"2220","Clive Palmer's wife to run for election in Queensland: Federal MP Clive Palmer has said his w... #ausnews #uavaus","news"
"2221","Canberra's mental health staff 'working in fear': Staff working at Canberra's Adult Mental He... #ausnews #uavaus","news"
"2222","New MRI machine may unravel mysteries of stroke: Scientists believe a next-generation MRI mac... #ausnews #uavaus","news"
"2223","Canberra's Lake Burley Griffin turns 50: Canberrans celebrate the 50th birthday of an integra... #ausnews #uavaus","news"
"2224","Australian medical chiefs to discuss preparedness for Ebola: The country's chief medical offi... #ausnews #uavaus","news"
"2225","New Zealand wins a seat on UN Security Council: New Zealand is one of five countries that hav... #ausnews #uavaus","news"
"2226","Remembering the Blue Mountains bushfires one year on: Blue Mountains residents will pause to ... #ausnews #uavaus","news"
"2227","Search for missing on Japan volcano called off until next year: Japan has called off the sear... #ausnews #uavaus","news"
"2228","Ebola fears prompt airline to place crew on leave: A US airline has placed six crew on leave ... #ausnews #uavaus","news"
"2229","Travellers lose $100,000 on scams: The consumer watchdog is warning people to be alert to bog... #ausnews #uavaus","news"
"2230","New anti-terror laws could endanger freedom of speech: critics: The second phase of the Gover... #ausnews #uavaus","news"
"2231","Bishop misses out on Inter-Parliamentary Union president: Federal Speaker Bronwyn Bishop has ... #ausnews #uavaus","news"
"2232","Millions of family-owned farms crucial to fight hunger: UN: The UN says nine out of ten of th... #ausnews #uavaus","news"
"2233","Boy burnt to death in India over straying goat: police: A low-caste teenage boy in India has ... #ausnews #uavaus","news"
"2234","BHP spin-off to list on London stock exchange: BHP Billiton says it plans to list its new $US... #ausnews #uavaus","news"
"2235","Cousin of Reeva Steenkamp says Pistorius ""needs sufficient punishment."": A cousin of Reeva St... #ausnews #uavaus","news"
"2236","French conductor 'not angry' about Bob Carr's walkout: The conductor of a French orchestra sa... #ausnews #uavaus","news"
"2237","WA Liberals will not support proposed one-metre cycling law: A proposed law to force West Aus... #ausnews #uavaus","news"
"2238","Researchers hope to make safety ratings for quad bikes: A farm safety conference in Launcesto... #ausnews #uavaus","news"
"2239","Sydney Uni 'disturbed' by professor's emails: The University of Sydney said has said it is ""d... #ausnews #uavaus","news"
"2240","Female prisoners more likely to reoffend after treatment: report: The State Government has de... #ausnews #uavaus","news"
"2241","PNG police appeal to public following sexual assaults: Police in Papua New Guinea are asking ... #ausnews #uavaus","news"
"2242","Hong Kong leader reopens offer of talks with protesters: Hong Kong's chief executive CY Leung... #ausnews #uavaus","news"
"2243","Jean Paul Gaultier opens Melbourne exhibition: French couturier Jean Paul Gaultier has opened... #ausnews #uavaus","news"
"2244","Power price relief in sight in Queensland: distributors: After years of electricity price hik... #ausnews #uavaus","news"
"2245","Ted Baillieu gives emotional farewell speech: Former Victorian premier Ted Baillieu said he w... #ausnews #uavaus","news"
"2246","Lindsay 'The Doctor' McDougall quits triple j: ABC youth music radio station triple j is bidd... #ausnews #uavaus","news"
"2247","Spectacular digital light show for Adelaide Festival of Arts: The Festival Theatre and the Ri... #ausnews #uavaus","news"
"2248","Stocks mount a comeback after a tumultuous day of trade: Australian banks led a market turnar... #ausnews #uavaus","news"
"2249","WA man guilty over fatal Indonesian bike crash: Geraldton man Jake Drage is found guilty of c... #ausnews #uavaus","news"
"2250","Free transport day in Perth to compensate for carbon tax on fares: Commuters in Perth will be... #ausnews #uavaus","news"
"2251","Epaulette shark to thrive from climate change: study: A timid reef shark is one of a small gr... #ausnews #uavaus","news"
"2252","Kobane 18yo detained in Turkey then returned to warzone: When Naz Abdi fled her hometown Koba... #ausnews #uavaus","news"
"2253","Commander breaks down during inquest into soldiers' deaths: A platoon commander has broken do... #ausnews #uavaus","news"
"2254","Slipper backs under-fire McKenzie ahead of Bledisloe Cup showdown: Wallabies prop James Slipp... #ausnews #uavaus","news"
"2255","Call for grain rail freight network to be reopened: A parliamentary committee wants the Gover... #ausnews #uavaus","news"
"2256","Union vows to save jobs as members vote for pay freeze proposal: The Community and Public Sec... #ausnews #uavaus","news"
"2257","Police officer on child abuse panel not forced to report: PIC: A police officer on an interna... #ausnews #uavaus","news"
"2258","Canberra man faces drug charges over online GBL order: A Canberra man has been remanded in cu... #ausnews #uavaus","news"
"2259","I was close to quitting AFL: Griffen: GWS recruit Ryan Griffen says he considered quitting AF... #ausnews #uavaus","news"
"2260","4yo girl survives 8 storey fall from Gold Coast apartment: A four-year-old girl has survived ... #ausnews #uavaus","news"
"2261","Man charged for failing to report fatal BASE jump: A Queensland man has been charged with fai... #ausnews #uavaus","news"
"2262","Timeline: How the 2013 Blue Mountains bushfires happened: One year ago, a string of catastrop... #ausnews #uavaus","news"
"2263","Emails between Flegg and son detailed in court: A defamation case in Brisbane has heard a min... #ausnews #uavaus","news"
"2264","Seniors and jobseekers learn new tricks at circus workshops: Seniors and jobseekers are two g... #ausnews #uavaus","news"
"2265","AFL trade week: Every deal analysed: A busy AFL trade period has come to an end - take a look... #ausnews #uavaus","news"
"2266","O'Keefe and Teague join Crows coaching staff: Former Swan Ryan O'Keefe and ex-St Kilda assist... #ausnews #uavaus","news"
"2267","Petrol spill in Botany Bay could cost Caltex $2m: EPA: A large petrol spill in July off Botan... #ausnews #uavaus","news"
"2268","Man secretly recorded admitting to Auburn shooting: court: A man has been secretly recorded i... #ausnews #uavaus","news"
"2269","Injury forces Dandino, Gris Caro out of Caulfield Cup: Leading overseas contender Dandino and... #ausnews #uavaus","news"
"2270","Boy, 7, killed in Mt Buller avalanche died of suffocation: A seven-year-old boy killed at Vic... #ausnews #uavaus","news"
"2271","MyState boss disappointed by latest results: The boss of Tasmania's newest bank, MyState, is ... #ausnews #uavaus","news"
"2272","SA Opposition child commissioner bill defeated: A push for an independent children's commissi... #ausnews #uavaus","news"
"2273","Parking rate hike at new hospital a burden on the sick: Opposition: Parking fees at Perth's n... #ausnews #uavaus","news"
"2274","Nearly 100m hit by natural disasters last year: report: Almost 100 million people were affect... #ausnews #uavaus","news"
"2275","Victorian naval base in lockdown, person arrested: A navy training base south-east of Melbour... #ausnews #uavaus","news"
"2276","Duntroon cadet accused of rape to face trial: Duntroon cadet Jonathan David Hibbert, 25, has ... #ausnews #uavaus","news"
"2277","Titans fined for Prince salary cap breach: The Gold Coast Titans have been fined $300,000 for... #ausnews #uavaus","news"
"2278","Exercise found to significantly cut risk of depression: Exercising three times a week reduces... #ausnews #uavaus","news"
"2279","Wallabies return for City's NRC clash with Vikings: Brisbane City has been boosted by the inc... #ausnews #uavaus","news"
"2280","Arnold cranks up derby mind games: Sydney FC coach Graham Arnold has claimed the Wanderers wi... #ausnews #uavaus","news"
"2281","Higher LNG prices boost Woodside sales revenue: Higher prices for liquefied natural gas have ... #ausnews #uavaus","news"
"2282","Qld to monitor Ebola health workers in Brisbane: The State Government says future health work... #ausnews #uavaus","news"
"2283","Category Three Hurricane Gonzalo set to deluge Bermuda, Bahamas: A Category Three hurricane c... #ausnews #uavaus","news"
"2284","Ryder completes trade to Power while Cooney, Giles go to Bombers: Ruckman Patrick Ryder has c... #ausnews #uavaus","news"
"2285","Locals 'kept in the dark' about Torres Strait TB cluster: A tuberculosis cluster has been ide... #ausnews #uavaus","news"
"2286","Vaughan tipped to be next NGA director: Art historian Gerard Vaughan is today expected to be ... #ausnews #uavaus","news"
"2287","Tony Abbott 'very reluctant' to send Australians to Ebola hotspots: Prime Minister Tony Abbot... #ausnews #uavaus","news"
"2288","Knee injury forces Diamonds captain Geitz out of England series: Australian captain Laura Gei... #ausnews #uavaus","news"
"2289","YouTube hit Harry Potter vs Star Wars wins award: Adelaide filmmaker Danny Philippou has won ... #ausnews #uavaus","news"
"2290","Gunman who shot intruder jailed for 8 years: An experienced shooter who shot dead an intruder... #ausnews #uavaus","news"
"2291","Ten Network posts $168 million loss: The Ten Network has posted a major full-year loss of $16... #ausnews #uavaus","news"
"2292","Third Melbourne council joins legal fight against East West Link: A third Melbourne council h... #ausnews #uavaus","news"
"2293","Neil Patrick Harris to host 2015 Oscars: Neil Patrick Harris will host next year's Academy Aw... #ausnews #uavaus","news"
"2294","Royals sweep Orioles to reach World Series: Kansas City secured a first World Series berth si... #ausnews #uavaus","news"
"2295","Japanese chefs fight to save national cuisine: Japanese youth are now eating more Western foo... #ausnews #uavaus","news"
"2296","Global markets fall as Wall Street's volatility jumps: Prices on foreign stock markets have d... #ausnews #uavaus","news"
"2297","Floriade attracts record number of visitors: Attendance figures for this year's Floriade Spri... #ausnews #uavaus","news"
"2298","Alonso is leaving Ferrari: Montezemolo: Ferrari's former chairman says Fernando Alonso is lea... #ausnews #uavaus","news"
"2299","New abuse charges against Retta Dixon houseparent unlikely: The ABC understands the Northern ... #ausnews #uavaus","news"
"2300","Troy Grant replaces Stoner as NSW Deputy Premier: Former Dubbo policeman and first term New S... #ausnews #uavaus","news"
"2301","Bono says 'Oops, sorry' for U2 iTunes download debacle: U2 lead singer Bono has apologised to... #ausnews #uavaus","news"
"2302","Several hundred IS fighters killed in Kobane: Islamic State (IS) militants could still seize ... #ausnews #uavaus","news"
"2303","Baby Ferouz' family to fight visa refusal: An asylum seeker family has vowed to fight a Feder... #ausnews #uavaus","news"
"2304","PNG, Australian policewomen swap countries to prevent domestic abuse: Two female police offic... #ausnews #uavaus","news"
"2305","ACT signs economic agreement with Shenzhen, China: The ACT Government has signed an economic ... #ausnews #uavaus","news"
"2306","McDowell makes winning start to Match Play defence: Graeme McDowell beat France's Alexander L... #ausnews #uavaus","news"
"2307","Sacked Liberal staffer makes MP porn ring claims: A sacked Victorian Liberal adviser has alle... #ausnews #uavaus","news"
"2308","Astronauts take spacewalk in race to fix ISS: A pair of NASA astronauts completed a spacewalk... #ausnews #uavaus","news"
"2309","Australia's Graham to enter golf's hall of fame: Australian two-time major winner David Graha... #ausnews #uavaus","news"
"2310","Wallabies ready to counter All Blacks: Joe Tomane says an on-field codeword will help the Wal... #ausnews #uavaus","news"
"2311","Kaymer wins Grand Slam title in play-off over Watson: Martin Kaymer sank an eight-foot birdie... #ausnews #uavaus","news"
"2312","Jockey dies after fall at Murray Bridge race: South Australian jockey Caitlin Forrest has die... #ausnews #uavaus","news"
"2313","Tomic stuns Kevin Anderson in Stockholm: Bernard Tomic marched into the quarter-finals of the... #ausnews #uavaus","news"
"2314","O'Keefe takes three wickets in Pakistan warm-up: Spinner Steve O'Keefe was the pick of Austra... #ausnews #uavaus","news"
"2315","Steenkamp family ruined by Pistorius shooting: cousin: Olympic and Paralympic athlete Oscar P... #ausnews #uavaus","news"
"2316","Philippines police file murder charges against US Marine: Philippines police have filed murde... #ausnews #uavaus","news"
"2317","Liberal senators urge Government against buying overseas subs: The message that the next gene... #ausnews #uavaus","news"
"2318","Govt resists call for national sex offender register: The Federal Government is resisting int... #ausnews #uavaus","news"
"2319","Nicola Sturgeon to become leader of Scottish nationalists: Nicola Sturgeon will become the ne... #ausnews #uavaus","news"
"2320","NRL boss Smith 'disappointed' to see Hayne go: NRL chief executive Dave Smith says there was ... #ausnews #uavaus","news"
"2321","Rottnest head murder accused 'liked victim': A man accused of murdering a drug dealer whose h... #ausnews #uavaus","news"
"2322","Anti-corruption commissioner defends SA probe secrecy: South Australia's anti-corruption comm... #ausnews #uavaus","news"
"2323","Learning of STD via text speeds treatment: doctor: Patients notified of sexually transmitted ... #ausnews #uavaus","news"
"2324","Schoenmakers staying with Hawks: Defender Ryan Schoenmakers has decided to remain with premie... #ausnews #uavaus","news"
"2325","Second Texas health worker tests positive for Ebola: A second healthcare worker who treated t... #ausnews #uavaus","news"
"2326","Concerns PTSD leading to higher number of veterans in jail: There are concerns post-traumatic... #ausnews #uavaus","news"
"2327","ADF personnel among best paid in the world: Vice Chief: The Vice Chief of the Defence Force s... #ausnews #uavaus","news"
"2328","Tasmanian food bank runs low on food: A Tasmanian emergency relief organisation is pleading f... #ausnews #uavaus","news"
"2329","WA Disability chief defends accomodation privatisation bid: Disability Services Commission di... #ausnews #uavaus","news"
"2330","Four killed, dozens missing in Nepal snowstorm: A snowstorm in the Himalayan region of centra... #ausnews #uavaus","news"
"2331","Police hope forensic tests can help solve double murder: Forensic tests are being carried out... #ausnews #uavaus","news"
"2332","Diamonds fight back to sweep Silver Ferns: Australia fought back in the final quarter to beat... #ausnews #uavaus","news"
"2333","Man Booker winner Flanagan 'ashamed to be Australian': Tasmanian author Richard Flanagan, win... #ausnews #uavaus","news"
"2334","Hong Kong police suspended after beating of protester: Hong Kong police involved in an assaul... #ausnews #uavaus","news"
"2335","Record-breaking students drive solar innovation: Fed up with soaring petrol prices and mounti... #ausnews #uavaus","news"
"2336","EPA wants Pilbara environment protected from mining: Western Australia's Pilbara needs a long... #ausnews #uavaus","news"
"2337","Blues, Warriors share points following abandoned one-day clash: New South Wales is back on to... #ausnews #uavaus","news"
"2338","Two Queensland bureaucrats charged with misconduct: Former Education Queensland director-gene... #ausnews #uavaus","news"
"2339","Four jockeys injured in fall at Murray Bridge: Two jockeys have been taken to hospital after ... #ausnews #uavaus","news"
"2340","Perth developer wants industrial area buffer plan scrapped: One of Western Australia's bigges... #ausnews #uavaus","news"
"2341","North, South Korea hold high-level military talks: reports: Senior military officials from No... #ausnews #uavaus","news"
"2342","Catholic Church offered MOU on child abuse, inquiry hears: The Catholic Church drafted a Memo... #ausnews #uavaus","news"
"2343","Boyd to Bulldogs, Griffen to GWS in big AFL deal: The Giants' Tom Boyd has been traded to the... #ausnews #uavaus","news"
"2344","Government urged to rule out cuts to Tas legal aid: Legal experts are concerned Tasmania's al... #ausnews #uavaus","news"
"2345","Two year's jail for Adelaide man who set fire to teenager: A young Adelaide man will spend at... #ausnews #uavaus","news"
"2346","Hayne given Eels' blessing to follow his heart into NFL: Parramatta was never going to stand ... #ausnews #uavaus","news"
"2347","Catholic priest jailed for abusing teen: A Catholic priest has been sentenced to 22 months' j... #ausnews #uavaus","news"
"2348","Essay: The Bumpkinification of the Midterm Elections ","news"
"2349","Citi Bike to Expand as New York City Reaches Deal With Private Company ","news"
"2350","In Hong Kong, Fears of a Police Crackdown Online ","news"
