"","user","type"
"1558","Kurdish forces, Iraqi troops push against IS militants: Kurdish forces in northern Iraq say t... #ausnews #uavaus","news"
"1559","WA court freezes accounts linked to money laundering: Western Australia's Supreme Court has g... #ausnews #uavaus","news"
"1560","Real claims El Clasico with 3-1 win over Barca: Real Madrid claimed Spanish bragging rights w... #ausnews #uavaus","news"
"1561","Hammers shock City as Saints march on: West Ham and Southampton's fine seasons continued with... #ausnews #uavaus","news"
"1562","Ukraine's president calls for support ahead of poll: Ukraine's president Petro Poroshenko has... #ausnews #uavaus","news"
"1563","Former Cream frontman Jack Bruce dies aged 71: Jack Bruce, a founding member of British psych... #ausnews #uavaus","news"
"1564","Mali vows to keep borders open despite Ebola death: Mali will not close its borders with neig... #ausnews #uavaus","news"
"1565","Turkey monitors 24 after powder sent to consulates: Turkey is keeping 24 people under observa... #ausnews #uavaus","news"
"1566","Man charged with attempted murder over brutal stabbing: Police have charged a 54-year-old man... #ausnews #uavaus","news"
"1567","Australia's response to Ebola chaotic, AMA says: The Federal Government's response to the Ebo... #ausnews #uavaus","news"
"1568","Biting is appalling but harmless, says Suarez: Luis Suarez says biting is wrong but harmless ... #ausnews #uavaus","news"
"1569","Olesen dreams of golf glory in Perth: Denmark's Thorbjorn Olesen has a three-stroke lead goin... #ausnews #uavaus","news"
"1570","Halep thumps Radwanska to set up rematch with Williams: Simona Halep has set up a rematch wit... #ausnews #uavaus","news"
"1571","Vic Labor promises to lift forced adoption contact vetoes: A law preventing biological parent... #ausnews #uavaus","news"
"1572","Iran hangs woman in defiance of international campaign: A 26-year-old Iranian woman who spent... #ausnews #uavaus","news"
"1573","Labor 'set to win' by-elections in NSW: Early results from today's New South Wales by-electio... #ausnews #uavaus","news"
"1574","Marc Marquez sets record with pole for Malaysian MotoGP: Recently crowned world champion Marc... #ausnews #uavaus","news"
"1575","Marc Marquez sets record with pole for Malaysian MotoGP: Recently crowned world champion Marc... #ausnews #uavaus","news"
"1576","Perth Spirit stun Melbourne Rising to reach NRC decider: Perth Spirit will meet Brisbane City... #ausnews #uavaus","news"
"1577","Perth Spirit stun Melbourne Rising to reach NRC decider: Perth Spirit will meet Brisbane City... #ausnews #uavaus","news"
"1578","Pakistan builds on lead on day four against Australia: Pakistan led Australia by 267 runs at ... #ausnews #uavaus","news"
"1579","Beijing shutters factories to stem air pollution for APEC meeting: Chinese vice premier Zhang... #ausnews #uavaus","news"
"1580","Beijing shutters factories to stem air pollution for APEC meeting: Chinese vice premier Zhang... #ausnews #uavaus","news"
"1581","Van Gisbergen takes out race one at Gold Coast 600: Holden driver Shane van Gisbergen has tak... #ausnews #uavaus","news"
"1582","Cheika says Beale will not join Wallabies: Michael Cheika says Kurtley Beale won't join the s... #ausnews #uavaus","news"
"1583","Google executive jumps from top of stratosphere: A Google executive has set a new record by j... #ausnews #uavaus","news"
"1584","Adelaide wins the Cox Plate for Aidan O'Brien: Adelaide has won the Cox Plate at Moonee Valle... #ausnews #uavaus","news"
"1585","Canadians line 'Highway of Heroes' to honour murdered soldier: The body of a Canadian soldier... #ausnews #uavaus","news"
"1586","Royals hold off Giants to take World Series lead: Kansas City Royals have hit the front in th... #ausnews #uavaus","news"
"1587","Rayney's lawyer questions objectivity of police murder review: The lawyer for former Perth ba... #ausnews #uavaus","news"
"1588","Prince of Penzance wins Moonee Valley Cup: The Darren Weir-trained Prince of Penzance has won... #ausnews #uavaus","news"
"1589","Australia's mosques throw open their doors: Mosques around the country have thrown open their... #ausnews #uavaus","news"
"1590","Rag-tag Sky Blues now a real team: Arnie: Sydney FC coach Graham Arnold was full of praise fo... #ausnews #uavaus","news"
"1591","Tests reveal remains found in central Qld are male: Preliminary forensic tests on human bones... #ausnews #uavaus","news"
"1592","Henley in sole charge after birdie blitz at Sea Island: Russell Henley posted eight birdies a... #ausnews #uavaus","news"
"1593","Warnings over new acid tattoo removal technique: Queensland's chief health officer Dr Jeannet... #ausnews #uavaus","news"
"1594","Gut organisms could be key to unlocking Western diseases: As the world of gut bacteria and ot... #ausnews #uavaus","news"
"1595","Man dies after jumping from Glenelg beach jetty: A man has died after jumping off the jetty a... #ausnews #uavaus","news"
"1596","'Fake cop' fronts court over armed robbery: A 29-year-old Gold Coast man has appeared in a Br... #ausnews #uavaus","news"
"1597","WA's Wheelchairs for Kids founders nominated for award: Two men who are the driving force beh... #ausnews #uavaus","news"
"1598","Shorten brings same-sex marriage message to Christian group: Opposition Leader Bill Shorten b... #ausnews #uavaus","news"
"1599","Sexting Queensland MP up for preselection: Queensland MP Peter Dowling, who gained internatio... #ausnews #uavaus","news"
"1600","Tougher penalties 'won't stop violence in health system': The Queensland Nurses Union (QNU) s... #ausnews #uavaus","news"
"1601","Mature Warner turns corner in Test arena: David Warner has turned the corner as a Test cricke... #ausnews #uavaus","news"
"1602","British PM rejects EU bill: British prime minister David Cameron is refusing to pay the Europ... #ausnews #uavaus","news"
"1603","Victoria's Woori Yallock pub burns down: Fire has destroyed the Woori Yallock Hotel east of M... #ausnews #uavaus","news"
"1604","WA students learn combined approach to health care: A new approach to health care, known as i... #ausnews #uavaus","news"
"1605","PGA president fired for insensitive remarks: PGA of America president Ted Bishop has been rem... #ausnews #uavaus","news"
"1606","Bid for historic bugle to be returned to WA: An 86-year-old Perth woman has taken on a Tasman... #ausnews #uavaus","news"
"1607","Multilateral trade deal inches closer with Sydney meeting: Federal Trade Minister Andrew Robb... #ausnews #uavaus","news"
"1608","Police hunt trio who attacked sleeping couple: Police are searching for three men who broke i... #ausnews #uavaus","news"
"1609","New York hatchet attack an 'act of terrorism', police say: Police have called an attack by a ... #ausnews #uavaus","news"
"1610","Success stories rise from ashes of Tasmanian bushfires: The bushfires that swept through Duna... #ausnews #uavaus","news"
"1611","Serena reaches Singapore semis to finish year as number one: Serena Williams progressed to th... #ausnews #uavaus","news"
"1612","Polls open for NSW by-elections after ICAC resignations: The polls have opened in NSW for sim... #ausnews #uavaus","news"
"1613","Fundraising ride to break 'taboo' of drug addiction: A night-time bike ride around Melbourne ... #ausnews #uavaus","news"
"1614","Nadal calls time on 2014 after Basel loss: Rafael Nadal lost in the quarter-finals of the Swi... #ausnews #uavaus","news"
"1615","Ex-world champion Mulaudzi dies in car crash: Former world 800 metres champion and Olympic si... #ausnews #uavaus","news"
"1616","US police respond to reported shooting at school in Marysville: Police and emergency workers ... #ausnews #uavaus","news"
"1617","Dallas nurse Nina Pham declared free of Ebola virus: American nurse Nina Pham, who contracted... #ausnews #uavaus","news"
"1618","Police investigate whether Ottawa shooter had help plotting attack: Canadian police are inves... #ausnews #uavaus","news"
"1619","Russian troops 'still inside Ukraine': NATO: Russia still has troops in eastern Ukraine and r... #ausnews #uavaus","news"
"1620","Lankan Rupee wins tight Manikato Stakes: Mick Price-trained favourite Lankan Rupee edged an i... #ausnews #uavaus","news"
"1621","Queen Elizabeth sends first tweet: Queen Elizabeth sends her first tweet while opening an exh... #ausnews #uavaus","news"
"1622","New South Wales beat Bulls to make one-day cricket final: New South Wales beat titleholder Qu... #ausnews #uavaus","news"
"1623","Woman in labour forces emergency plane landing in Bali: A Malaysia Airlines flight has made a... #ausnews #uavaus","news"
"1624","Queensland girl, 3, critical after balcony fall: A three-year-old girl has been airlifted to ... #ausnews #uavaus","news"
"1625","Pintupi mark first contact with white Australia: The last remaining group of Indigenous Austr... #ausnews #uavaus","news"
"1626","Sydney FC dismantles winless Roar: Marc Janko's wonder-goal helped Sydney FC beat a lacklustr... #ausnews #uavaus","news"
"1627","WHO sends Ebola experts to Mali as Europe boosts aid: The World Health Organisation sends exp... #ausnews #uavaus","news"
"1628","Beale's ARU conduct hearing finishes: Kurtley Beale's code of conduct hearing at the ARU has ... #ausnews #uavaus","news"
"1629","Sweden calls off search for mystery submarine: Sweden has called off the hunt for a suspected... #ausnews #uavaus","news"
"1630","Murdoch vice chancellor resigns amid CCC probe: The Murdoch University vice-chancellor under ... #ausnews #uavaus","news"
"1631","Rolling Stones concert tests SA scalping laws: New laws to target ticket scalpers will be put... #ausnews #uavaus","news"
"1632","Market finishes higher on mining stocks, Qantas profit statement: The share market finished h... #ausnews #uavaus","news"
"1633","French journalists handed short jail terms in Papua: Two French journalists detained in Indon... #ausnews #uavaus","news"
"1634","Muir's second chief of staff quits after two months: The chief of staff to Motoring Enthusias... #ausnews #uavaus","news"
"1635","Troy Buswell won't 'misuse' former position: Barnett: WA Premier Colin Barnett has defended f... #ausnews #uavaus","news"
"1636","Ebola 'scary' for paramedics lacking proper training: Australian paramedics say they are unpr... #ausnews #uavaus","news"
"1637","Euthanasia advocate dies after appeal for lethal drug: A voluntary euthanasia advocate who us... #ausnews #uavaus","news"
"1638","Toll boss to call Daniel Andrews about East West Link: The Victorian Labor Party's pledge to ... #ausnews #uavaus","news"
"1639","Qld considers protecting genes from discrimination: Queensland could become the first state t... #ausnews #uavaus","news"
"1640","Bush stone-curlew reintroduced in ACT woodlands: The bush stone-curlew is being reintroduced ... #ausnews #uavaus","news"
"1641","Hetty Johnston named Queenslander of the Year: Bravehearts founder and child protection advoc... #ausnews #uavaus","news"
"1642","Inquest told no systemic failures despite soldier deaths: A brigadier has testified there wer... #ausnews #uavaus","news"
"1643","Fashion Icons: Masterpieces from Paris come to SA: Iconic fashion from some of the world's le... #ausnews #uavaus","news"
"1644","More surgeons for Geelong hospital to cut waiting times: Surgeons from Melbourne's Royal Chil... #ausnews #uavaus","news"
"1645","Wanderers want nothing less than ACL title: Wanderers coach Tony Popovic says his team risks ... #ausnews #uavaus","news"
"1646","Pacific Islands Forum lifts Fiji's suspension: The Pacific Islands Forum says Fiji's suspensi... #ausnews #uavaus","news"
"1647","Britons have worse oral health than Romans did: study: Britons have worse oral health today t... #ausnews #uavaus","news"
"1648","Athletics Australia boss announces resignation: Athletics Australia (AA) has announced chief ... #ausnews #uavaus","news"
"1649","Japan beats Singapore to place in 2016 Super Rugby: Japan has been named as the preferred can... #ausnews #uavaus","news"
"1650","MH17 victims Wayne and Theresa Baker farewelled in Darwin: Theresa Baker was ""full of zest"" a... #ausnews #uavaus","news"
"1651","Flintoff relishing Big Bash clash with Pietersen: Brisbane Heat recruit Andrew Flintoff is lo... #ausnews #uavaus","news"
"1652","Winderlich to return for Bombers in 2015: Essendon has confirmed veteran Jason Winderlich wil... #ausnews #uavaus","news"
"1653","Wallabies eying clean sweep in Europe under Cheika: The Wallabies are en route to London with... #ausnews #uavaus","news"
"1654","Cancer patients demand trial drugs rather than placebo: Cancer specialists meeting in Adelaid... #ausnews #uavaus","news"
"1655","'Out-of-control' party hosts found not guilty: The first people charged under WA's out-of-con... #ausnews #uavaus","news"
"1656","Happy Trails set for emotional Cox Plate return: For Happy Trails and trainer Paul Beshara, t... #ausnews #uavaus","news"
"1657","Federal Government launches financial planner register: The Federal Government is launching a... #ausnews #uavaus","news"
"1658","Heat and wind play havoc with Tasmanian crops: An unseasonably warm, dry spring is playing ha... #ausnews #uavaus","news"
"1659","Gallen apologises for offensive tweet directed at NRL: Cronulla captain Paul Gallen has issue... #ausnews #uavaus","news"
"1660","'Thrill killer' sentenced over Melbourne double murder: A 21-year-old man who stabbed a Melbo... #ausnews #uavaus","news"
"1661","Adelaide gunsmith and backyard firearms dealer jailed: A backyard firearms manufacturer in Ad... #ausnews #uavaus","news"
"1662","EU reaches landmark climate change deal: European Union leaders have reached a landmark clima... #ausnews #uavaus","news"
"1663","Wedding ring found at Nazi camp might have Adelaide connection: Archaeologists have made a re... #ausnews #uavaus","news"
"1664","Ex-Magpie Beams relieved with trade to Lions: Dayne Beams says he felt like the meat in the s... #ausnews #uavaus","news"
"1665","Fatal crash victim's card stolen, used in purchases: A credit card stolen from the victim of ... #ausnews #uavaus","news"
"1666","Joshua Hardy's family call for end to boozy violence: The family of Joshua Hardy, who died af... #ausnews #uavaus","news"
"1667","Unions hand Tasmanian Government alternative savings plan: Tasmanian unions have handed a sav... #ausnews #uavaus","news"
"1668","Eagles axe Wilson, Carter from AFL list: Blayne Wilson and Adam Carter have joined Ashley Smi... #ausnews #uavaus","news"
"1669","Hatchet-wielding attacker hacks New York police officers: A hatchet-wielding attacker has cha... #ausnews #uavaus","news"
"1670","Banking regulator outlines likely response to housing investor surge: Investors remain in the... #ausnews #uavaus","news"
"1671","Proposal released to triple the size of Adelaide airport: A new 30-year blueprint for a $2 bi... #ausnews #uavaus","news"
"1672","Victim's family makes emotional gun control plea: The family of a man shot dead in central Vi... #ausnews #uavaus","news"
"1673","Ukrainian PM warns Russia may try to disrupt election: Ukraine's prime minister Arseniy Yatse... #ausnews #uavaus","news"
"1674","Negotiator removed from paramedic pay talks: A senior Health Department negotiator has been r... #ausnews #uavaus","news"
"1675","SES join search for more bones in Rockhampton: Police say they expect to find out more over t... #ausnews #uavaus","news"
"1676","Japan tipped for Super Rugby expansion: The New Zealand Rugby Union says Japan is the preferr... #ausnews #uavaus","news"
"1677","Henry says eurozone collapse inevitable, depression unlikely: The former head of the Commonwe... #ausnews #uavaus","news"
"1678","Australian doctors transplant heart that had stopped beating: For the first time, Australian ... #ausnews #uavaus","news"
"1679","Developers appeal Gold Coast mosque rejection: Developers have launched a legal appeal agains... #ausnews #uavaus","news"
"1680","Baddeley in the mix at US PGA event: Aaron Baddeley finished the opening round of the US PGA ... #ausnews #uavaus","news"
"1681","Super funds raise alarm on contributions being dropped from payslips: Industry Super Australi... #ausnews #uavaus","news"
"1682","Australia needs to go on with strong start: O'Keefe: After five long sessions in the field, A... #ausnews #uavaus","news"
"1683","Ogilvy faces battle at Perth International: One-time major winner Geoff Ogilvy will be aiming... #ausnews #uavaus","news"
"1684","Fake police officer pulls gun on motorist: An armed man pretending to be a police officer pul... #ausnews #uavaus","news"
"1685","Canadian gunman had troubled, transient past: The Islamic convert that police say killed a so... #ausnews #uavaus","news"
"1686","How cattleman Arthur Hopkins met Gough Whitlam: The day cattleman Arthur Hopkins returned hom... #ausnews #uavaus","news"
"1687","Three alternative systems of political donations in the NT: The Northern Territory Labor part... #ausnews #uavaus","news"
"1688","Wall St jumps on earnings and optimism: Wall Street jumped on strong corporate earnings and p... #ausnews #uavaus","news"
"1689","Comet smells like rotten eggs, horse urine, alcohol: Rotten eggs, horse urine, alcohol, and b... #ausnews #uavaus","news"
"1690","Australian War Memorial security under review: The Australian War Memorial (AWM) in Canberra ... #ausnews #uavaus","news"
"1691","Isis Downs Shearing Shed celebrates century: A renowned shearing shed in Queensland's west wi... #ausnews #uavaus","news"
"1692","Families SA should not investigate its carers: Anglicare: South Australian Government child p... #ausnews #uavaus","news"
"1693","Devonport court faces uncertain future under redevelopment: There are more concerns about the... #ausnews #uavaus","news"
"1694","Murray, Ferrer cruise into Valencia last eight: Andy Murray inched closer to a place at the A... #ausnews #uavaus","news"
"1695","Man charged over White House security scare: A man who jumped the White House fence, on the s... #ausnews #uavaus","news"
"1696","Sign language interpreter in ACT Parliament for first time: Debate in the ACT's Parliament ha... #ausnews #uavaus","news"
"1697","Boko Haram militants abduct dozens more girls in Nigeria: Boko Haram militants have been accu... #ausnews #uavaus","news"
"1698","Papua New Guinea to set up anti-corruption hotline: Papua New Guinea's prime minister Peter O... #ausnews #uavaus","news"
"1699","Canadian MPs applaud sergeant-at-arms who killed gunman: Canada's parliament has reopened wit... #ausnews #uavaus","news"
"1700","Schumacher's recovery will take years: doctor: A doctor treating Michael Schumacher says the ... #ausnews #uavaus","news"
"1701","UN rights body calls for open elections in Hong Kong: The United Nations Human Rights Committ... #ausnews #uavaus","news"
"1702","Gang violence drives Central Americans across border into US: Tens of thousands of women and ... #ausnews #uavaus","news"
"1703","N Korea halts foreign tours over Ebola fears: agents: North Korea will close its borders to f... #ausnews #uavaus","news"
"1704","Finalists announced in 2014 Walkley Awards: The finalists in the 2014 Walkley Awards for exce... #ausnews #uavaus","news"
"1705","Folau emphatically takes out John Eales Medal: Israel Folau has won the John Eales Medal for ... #ausnews #uavaus","news"
"1706","Murder charges laid in deaths of man, woman and son: A 63-year-old man has been charged with ... #ausnews #uavaus","news"
"1707","Rejection of costly Hep C treatment a 'death sentence': Liver experts have been told the rece... #ausnews #uavaus","news"
"1708","Russia detains four over plane crash involving snow plough: Russia has detained four Moscow a... #ausnews #uavaus","news"
"1709","Tasmanian women cyclists on top of the world: Tasmania's reputation for producing world class... #ausnews #uavaus","news"
"1710","Bhutan's riding royal brings education cause to Canberra: The Queen Mother of Bhutan promotes... #ausnews #uavaus","news"
"1711","US-led air strikes kill 553 people in Syria: monitor: Air strikes by US-led forces in Syria h... #ausnews #uavaus","news"
"1712","iiNet fights legal threat to name customers who illegally download: Australian internet users... #ausnews #uavaus","news"
"1713","Wozniacki too good for Radwanska in WTA Finals: Caroline Wozniacki looks set to reach the sem... #ausnews #uavaus","news"
"1714","EPA to not change MRM water license, despite lead levels: The NT EPA will not make any change... #ausnews #uavaus","news"
"1715","ACT politician's son sentenced over armed robbery: The son of an ACT politician has received ... #ausnews #uavaus","news"
"1716","Teen jockey who died in race fall farewelled in SA: More than 1,200 people have attended the ... #ausnews #uavaus","news"
"1717","Japanese trade minister's staff visited Hiroshima bondage bar: Japan's new industry minister ... #ausnews #uavaus","news"
"1718","Nathan Tinkler's Patinack Farm fails to sell at auction: Businessman Nathan Tinkler's thoroug... #ausnews #uavaus","news"
"1719","Gap between student performance wider since Gonski: report: The gap between student performan... #ausnews #uavaus","news"
"1720","Infectious diseases expert named as Australia's Ebola tsar: One of Australia's leading doctor... #ausnews #uavaus","news"
"1721","Female gamers and developers threatened in 'gamergate' dispute: Female video game developers ... #ausnews #uavaus","news"
"1722","Doctors who helped paralysed man walk seek patients: A team of doctors who helped a paralysed... #ausnews #uavaus","news"
"1723","Demolition of Gough Whitlam's childhood home halted: The demolition of Gough Whitlam's childh... #ausnews #uavaus","news"
"1724","Former Blackwater guards found guilty of Baghdad killings: A US federal jury has found three ... #ausnews #uavaus","news"
"1725","Bulldogs pinch Morris from Dragons on four-year deal: Brett Morris will play alongside his tw... #ausnews #uavaus","news"
"1726","Convicted Perth drug dealer drops PTSD claim: A convicted Perth drug dealer has dropped his c... #ausnews #uavaus","news"
"1727","Drunken petrol attack on police officer leads to jail: A man who doused an Adelaide police of... #ausnews #uavaus","news"
"1728","Wade leads Perth International as Sim hits hot form: Victoria's John Wade has hit the lead at... #ausnews #uavaus","news"
"1729","Thaw reveals Antarctic explorer's century-old notebook: A photographic notebook from Captain ... #ausnews #uavaus","news"
"1730","Thousands enjoy People's Day at Royal Hobart Show: At least 15,000 people have poured through... #ausnews #uavaus","news"
"1731","Kyrgios among Newcombe Medal nominees: Nick Kyrgios, Samantha Stosur, Casey Dellacqua and Lle... #ausnews #uavaus","news"
"1732","Rare whale washes up on Sunshine Coast: Marine experts will examine a rare deep sea whale tha... #ausnews #uavaus","news"
"1733","Man tells court his confession to shooting at an Auburn home was fake: A man accused of shoot... #ausnews #uavaus","news"
"1734","Man arrested in central Canberra over alleged assault: A man wanted in connection to an alleg... #ausnews #uavaus","news"
"1735","Burgess named RLIF player of the year: Sam Burgess has been named the RLIF's International Pl... #ausnews #uavaus","news"
"1736","Adelaide coach jailed for breaching child sex offender laws: A respected and highly sought af... #ausnews #uavaus","news"
"1737","Nationals block support for local government plan: WA Premier Colin Barnett's plans to expand... #ausnews #uavaus","news"
"1738","Reebok fined for false claims about muscle toning shoes: The Federal Court has ordered Reebok... #ausnews #uavaus","news"
"1739","Goodfellas actor sues over Simpsons mafia character: Goodfellas actor Frank Sivero has sued F... #ausnews #uavaus","news"
"1740","Man found dead in Gold Coast unit block: Police have established a crime scene at a Gold Coas... #ausnews #uavaus","news"
"1741","Grants to community groups extended ahead of new arrangements: The Federal Government says it... #ausnews #uavaus","news"
"1742","Baby killed in 'terrorist attack' as car ploughs into pedestrians in Jerusalem: Israel blames... #ausnews #uavaus","news"
"1743","Khawaja out for Bulls with broken thumb: Queensland star Usman Khawaja has been ruled out of ... #ausnews #uavaus","news"
"1744","Can anyone beat the Rolling Stones for music longevity?: Currently in Australia, the Rolling ... #ausnews #uavaus","news"
"1745","Man jailed for raping man who owed drug debt: A man convicted of bashing and raping another m... #ausnews #uavaus","news"
"1746","Lawyers accused of  'wearing plaintiffs down' in sex abuse case: NSW Government lawyers have ... #ausnews #uavaus","news"
"1747","Security boost at Qld Parliament after Canadian attack: Security has been beefed up at Queens... #ausnews #uavaus","news"
"1748","Man jailed for raping man who owed drug debt: A man convicted of bashing and raping another m... #ausnews #uavaus","news"
"1749","Lawyers accused of  'wearing plaintiffs down' in sex abuse case: NSW Government lawyers have ... #ausnews #uavaus","news"
"1750","Security boost at Qld Parliament after Canadian attack: Security has been beefed up at Queens... #ausnews #uavaus","news"
"1751","CSIRO sheds light on new ship's power problems: A senior CSIRO bureaucrat has revealed more d... #ausnews #uavaus","news"
"1752","Luke Batty inquest: Father was '100 per cent bad': A police officer involved with the family ... #ausnews #uavaus","news"
"1753","Teacher urges SA court not to jail him over child porn: A teacher who admitted child pornogra... #ausnews #uavaus","news"
"1754","Guard sacked over anti-coal sign takes legal action: A former security guard is taking legal ... #ausnews #uavaus","news"
"1755","Watson makes domestic one-day return: Shane Watson will make his return for New South Wales a... #ausnews #uavaus","news"
