"","user","type"
"802","Tennis: Federer wins sixth Basel title ","news"
"803","Concerns mount over US Ebola quarantine ","news"
"804","German spies warn IS has anti-aircraft rockets: Report ","news"
"805","No laughing matter: Clown terror spreads in France ","news"
"806","PM @leehsienloong joined more than 1,000 residents at an Ang Mo Kio-Hougang Deepa Oli carnival ","news"
"807","A new video aims to educate foreign workers on employment practices and their rights in S'pore ","news"
"808","#OccupyCentral leaders have said the cancellation of a poll will not affect protesters' morale ","news"
"809","Singapore has confidence in China's growth and future prospects, says DPM Teo Chee Hean ","news"
"810","Egypt sentences 23 pro-democracy protesters to 3 years ","news"
"811","High security in Myanmar ahead of ASEAN Summit ","news"
"812","It's official: 25 eurozone banks flunk ECB financial health test ","news"
"813","Myanmar to be on highest security alert when it hosts the 25th ASEAN Summit next month ","news"
"814","Serena Williams beats Simona Halep to win the WTA Finals Championship in Singapore ","news"
"815","Tennis: Williams wins WTA Finals ","news"
"816","Vote suspension does not mean end to Occupy movement: Protest leaders ","news"
"817","Vietnam arrests top banker in fraud probe ","news"
"818","Indonesia's Widodo unveils cabinet including female foreign minister ","news"
"819","Heartwarming stories by Sembawang residents on Singapore to be compiled into a book ","news"
"820","Indonesia announces 34-member cabinet ","news"
"821","Singapore to continue requesting for higher haj quota ","news"
"822","JUST IN: Indonesia’s new president Joko Widodo has announced his 34-member cabinet ","news"
"823","Singapore to request for a higher haj quota as construction works in Mecca conclude ","news"
"824","China to keep closer eye on military spending: Xinhua ","news"
"825","Teen isolated, tested for Ebola virus in Australia ","news"
"826","Australian teen with fever quarantined, undergoing tests for #Ebola after a trip to Guinea ","news"
"827","Motorcycling: Marquez clinches record 12th win in Malaysia ","news"
"828","Badminton: Malaysian officials ""shocked"" over doping claims ","news"
"829","Syria regime air strikes kill 11 children: Monitor ","news"
"830","Hong Kong protest leaders suspend planned vote: Organisers ","news"
"831","Pakistan air strikes kill 18 militants ","news"
"832","Japan PM's support dented after female ministers quit: Poll ","news"
"833","Singapore has ""strongly condemned"" a suicide car bombing in Egypt that killed 30 soldiers ","news"
"834","#OccupyCentral protest leaders have cancelled a street poll due to ""many different opinions"" ","news"
"835","India chooses Israel for US$525m missile deal ","news"
"836","Tight security for 'defining' Tunisia vote ","news"
"837","Simulated terror attacks occurred at Dhoby Ghaut, Downtown MRT stations today (@TODAYonline) ","news"
"838",".@NEAsg says thunderstorms mainly over northern and western Singapore in the late afternoon ","news"
"839","Church blaze kills four in central Japan ","news"
"840","Police are investigating after DBS ATM, POSB cash deposit machine were splashed with paint ","news"
"841","Hong Kong protesters to hold street vote on next steps ","news"
"842","Off-grid German village banks on wind, sun, pig manure ","news"
"843","Old ties, new links, opportunities – President Tan sums up relationship between S'pore and UK ","news"
"844","Delhi chokes on toxic smog after festival of lights ","news"
"845","S$30m fund created to support projects aimed at helping disabled people and their caregivers ","news"
"846","A US nurse who took care of Ebola patients in West Africa was made to feel like ""a criminal"" ","news"
"847","No easy retirement in South Korea ","news"
"848","Thailand promotes prawn industry to counter slavery row ","news"
"849","S$30 million fund to help people with disabilities and their caregivers ","news"
"850","WATCH: Minister Tan Chuan-Jin abseils down a HDB block to launch an adventure interest group ","news"
"851","Police appeal for information in criminal trespass case ","news"
"852","War-scarred Ukraine votes for pro-Western future ","news"
"853","UK-Singapore Financial Dialogue to take place Jan 27-28 ","news"
"854","Quarantined US nurse says 'made to feel like a criminal' ","news"
"855","Police are looking for this man to assist with investigations into a criminal trespass case ","news"
"856","US struggles to turn the tide in war against Islamic State ","news"
"857","Keat Hong Constituency launches 'Care on Wheels' for needy residents ","news"
"858","Republicans poised to snatch US Senate in mid-terms ","news"
"859","Football: Wanderers 'halfway to something special' in AFC Champions League ","news"
"860","Five hurt in Canada industrial explosion ","news"
"861","Jack Bruce, bassist with rock legends Cream, dies aged 71 ","news"
"862","Divided Brazil votes for next president ","news"
"863","Rugby: Toulon and Toulouse give French away day cheer ","news"
"864","Football: Classy PSG make Bordeaux pay penalty ","news"
"865","Three Turkish soldiers shot dead in 'terrorist' attack ","news"
"866","Tennis: Goffin ends Coric dream run to make Swiss final ","news"
"867","Football: Dortmund slip further after fourth defeat ","news"
"868","Tennis: Murray edges out Ferrer to reach Valencia final ","news"
"869","Indian PM in first formal interaction with media ","news"
"870","Obama reassures Ebola-wary American public ","news"
"871","Singapore-UK ties, new links and opportunities: Tony Tan ","news"
"872","Million kg Challenge back for second season ","news"
"873","Book to feature stories by Sembawang GRC residents ","news"
"874","Egypt attacks stark reminders of terrorist threat: MFA ","news"
"875","India clears defence projects worth US$13b: Report ","news"
"876","Developer CapitaLand put up Earth Harp performance, fireworks to celebrate the milestone ","news"
"877","Largest condo project in S'pore - d'Leedon - completed, but 254 of 1,700 units still unsold ","news"
"878","d’Leedon condominium marks its completion ","news"
"879","Protesters top one million in anti-job reform Rome rally ","news"
"880","1 million: No of people who took to Romes' streets to protest PM Matteo Renzi's labour reforms ","news"
"881","Thai students demand justice 10 years after Tak Bai killings ","news"
"882","Tennis: Serena earns shot at title, revenge against Halep ","news"
"883","Special SG50 gift for S’porean couples getting married in 2015 ","news"
"884","Football: Pires suspended and fined for scuffle in India league ","news"
"885","Getting married next year? A special cert holder is being created for you #sg50 ","news"
"886","Ex-Gunner @piresrobert7 gets 2-match ban for HT scuffle during #IndianSuperLeague match ","news"
"887","Manchester City (@MCFC) suffers shock 2-1 defeat at Upton Park. 2nd league defeat leaves them 5 points adrift of @chelseafc, who play Sunday","news"
"888","""It took blood, sweat, tears"": Jovin Tan. She and Yap Qian Yin won gold at #AsianParaGames2014 ","news"
"889","Singapore athletes return from Asian Para Games ","news"
"890","US says 'scaled-down' military drills to go ahead in Thailand ","news"
"891","Visitors try driverless buggies at Chinese and Japanese Gardens ","news"
"892","25 eurozone banks fail ECB stress test: Reports ","news"
"893","Turkey monitoring 24 people over yellow powder scare ","news"
"894","DPM Teo to make official three-day visit to China ","news"
"895","Want a ride? Driverless buggies were on offer at Chinese, Japanese Gardens for visitors ","news"
"896","Sick banks: 25 Eurozone banks fail health check by European Central Bank ","news"
"897","English champions @MCFC currently down 1-0 against West Ham (@whufc_official) at Upton Park. Morgan Amalfitano with goal #WHUFCVMCFC","news"
"898","24 people under observation after suspicious yellow powder sent to 5 consulates in #Istanbul ","news"
"899","DPM @teocheehean to make 3-day visit to China; will co-chair 11th Joint Council for Bilateral Cooperation meeting ","news"
"900","Tennis: Halep beats Radwanska to reach WTA Finals title match ","news"
"901","Lebanon army attacks gunmen in historic Tripoli market ","news"
"902","Can @simona_halep do the double against @serenawilliams during #WTAFinals? @WTAFinalsSG ","news"
"903","State of emergency invoked after 30 soldiers were killed by a car bomb in #Egypt ","news"
"904","SOUK ATTACK: Fire-fight in Tripoli results in 1 dead and 17 injured, including 8 civilians ","news"
"905","Organiser apologises over 'I Want to Touch a Dog' event ","news"
"906","#WTAFinals: @simona_halep goes through to Finals against @serenawilliams; sweeps @ARadwanska 6-2, 6-2","news"
"907","""I Want to Touch a Dog"" organiser apologises;says event not meant to distort Islamic teachings ","news"
"908","Singaporean held in Batam unaware he's on Interpol list ","news"
"909","Emergency rule in Egypt's Sinai after bomb kills 30 soldiers ","news"
"910","RT @yunsukCNA: Balloons sent from Ganghwa after #imjingak effort. Defector: Important not to give in to #DPRK threats ","news"
"911","RT @ByFarisMokhtar: @ARadwanska serving 1-5 down, trying to stay in the 1st set. Can she hang on?","news"
"912","Lim is reportedly wanted by US for allegedly smuggling electronic parts from US to Iran, between 2007-2008 ","news"
"913","Singaporean Lim Yong Nam arrested in Batam on @Interpol's Red Notice List; lawyer says Lim did not know of this ","news"
"914","RT @ByFarisMokhtar: #Halep and #Radwanska treating crowd with some long rallies early in match. 1-1 on scoreboard ","news"
"915","RT @ByFarisMokhtar: @ARadwanska Vs @simona_halep - who will face @serenawilliams in the #WTAFinals? ","news"
"916","RT @yunsukCNA: Defector: Activists on way to another location after 2 failed attempts ","news"
"917","Tennis: Racquet-smashing Serena wins Wozniacki thriller ","news"
"918","Myanmar army kills 'reporter' in custody: press body ","news"
"919","""Reporter"" Aung Naing gunned down after trying to flee detention: Myanmar Press Council ","news"
"920","RT @ByFarisMokhtar: @serenawilliams: ""I have a reset button when I'm down. I hit it, try to fight for every point and look at positives.""","news"
"921","RT @ByFarisMokhtar: ""@CaroWozniacki played super aggressive. Made few errors"": @serenawilliams ","news"
"922","RT @ByFarisMokhtar: @serenawilliams on smashing racket during match: ""I can lose my cool a little bit"" ","news"
"923","RT @ByFarisMokhtar: @serenawilliams' post-match press con begins ","news"
"924","ONE DAY MORE: @ARadwanska or @simona_halep stand in @serenawilliams' way of winning #WTAFinals ","news"
"925","Iran loses lawsuit in Taiwan over arms scam: Reports ","news"
"926","Tennis: Williams beats Wozniacki to reach WTA Finals title match ","news"
"927","Golf: PGA president sacked over Poulter 'lil girl' jibe ","news"
"928","PGA of America President #TedBishop sacked for calling @IanJamesPoulter ""lil girl"" on #Twitter ","news"
"929","Final score between @serenawilliams v @CaroWozniacki: 2-6, 6-3, 7-6","news"
"930","#WTAFinals: @serenawilliams powers past @CaroWozniacki and into the finals after a 3-set struggle spanning 2 hours ","news"
"931","Botswana ruling party leads in early election results ","news"
"932","Italian court quashes Dolce &amp; Gabbana fraud convictions ","news"
"933","Motorcycling: Marquez grabs pole for Malaysian MotoGP ","news"
"934","India 'love jihad' claims fuel Hindu-Muslim tensions ","news"
"935","Momentum building on Pacific trade deal: Australia, US ","news"
"936","It's neck and neck now in 1st #WTAFinals semis: @serenawilliams v @CaroWozniacki 2-6, 6-3, 5-5 ","news"
"937","Virtual #OccupyHK: Yellow Umbrella mobile game has players fend off attacks on protest lines ","news"
"938","Badminton: Malaysia to get doping test result next month ","news"
"939","Egypt imposes state of emergency in Sinai after bomb kills 30 soldiers ","news"
"940","Malaysian envoy in New Zealand police custody on sex charge ","news"
"941","IMF fights negative interest rates ","news"
"942","Two US states order tough Ebola quarantine rules ","news"
"943","Google exec makes record skydive from edge of space ","news"
"944","Canada seeks to beef up security after attacks ","news"
"945","North Korea likely can build nuclear warhead: US general ","news"
"946","Investors punish Amazon after hefty losses ","news"
"947","Israeli troops shoot dead Palestinian teen in West Bank ","news"
"948","New York police brand hatchet attack 'terrorist' act ","news"
"949","Dollar dips in cautious trade ahead of Fed meeting ","news"
"950","Motor Racing: Title-chasing Ogier maintains lead in Spain ","news"
"951","Tennis: Nadal calls time on 2014, faces November surgery ","news"
"952","US school shooting leaves gunman, student dead ","news"
"953","US stocks push higher despite big Amazon drop ","news"
"954","Car bomb in Egypt's Sinai kills 28 soldiers ","news"
"955","Oil prices slide amid questions on reported Saudi cuts ","news"
"956","War-scarred Ukraine counts down to key vote ","news"
"957","Athletics: Ex-world 800m champion Mulaudzi dies in car crash ","news"
"958","Two US nurses declared cured of Ebola ","news"
"959","Student gunman wounds seven at US school ","news"
"960","Frustration at UN climate talks despite EU deal ","news"
"961","Tennis: Nadal pulls out of Paris Masters as surgery looms ","news"
"962","Rebels, peshmerga set to reinforce Syria's Kobane ","news"
"963","Student wounds six, kills self in US school shooting ","news"
"964","Football: European clubs campaign against Qatar winter World Cup ","news"
"965","Italy to open Nero's Golden House for weekend tourists ","news"
"966","Mexico governor steps down over student disappearances ","news"
"967","Tennis: Ferrer hits 600 wins, faces Murray in Valencia ","news"
"968","Snowplough in Total crash reversed into jet's path: Probe ","news"
"969","Angry Cameron vows not to pay new British EU bill ","news"
"970","Tennis: Murray battles past Anderson into Valencia semis ","news"
"971","Modi government takes RTI to another level ","news"
"972","Singapore, UK reaffirm commitment to combat ill effects of climate change ","news"
"973","Persuading students to study engineering a challenge: Prof Lui ","news"
"974","US new home sales creep up to highest level in 6 years ","news"
"975","Mass Ebola vaccines for Africa within 8 months: WHO ","news"
"976","Hundreds of thousands #Ebola vaccine doses to roll out by mid-2015; trials likely in Dec: @WHO ","news"
"977","Britain's Cameron says won't pay EU bill on Dec 1 ","news"
"978","Touching dogs un-Islamic: Malaysia's National Fatwa Council ","news"
"979","Banking and finance jobs on the rise in Singapore ","news"
"980","Microsoft drops Nokia name from smartphones ","news"
"981",".@David_Cameron turns red and bangs lectern after EU orders UK to pay backdated US$2.6b bill ","news"
"982","“Against mainstream religious doctrine”: Malaysia’s Islamic authorities on dog touching. @sumishanaidu reports ","news"
"983","Football: @rioferdy5 hints this season could be his last, says ""not fearful"" of retirement ","news"
"984","Tennis: Ivanovic downs Halep but fails to reach WTA Finals semis ","news"
"985","Misconceptions, vaccine ban impede Pakistan's polio fight ","news"
"986","CDAC raises S$17.8m at charity dinner ","news"
"987","Motor Racing: Administrator takes charge of ailing Caterham F1 team ","news"
"988","Restaurant break-ins: Four women arrested ","news"
"989","#WTAFinals: @AnaIvanovic downs @simona_halep 7-6 (9-7), 3-6, 6-3 but fails to reach semi-finals ","news"
"990","High-speed rail: Singapore wants updated feasibility study from Malaysia ","news"
"991","Sweden says 'at least one' vessel operated in its waters ","news"
"992","Football: Rio Ferdinand says to retire at end of season ","news"
"993","Han Hui Hui, Roy Ngerng face two charges for Hong Lim Park protest ","news"
"994","Asia markets mixed after Wall Street gains ","news"
"995","P&amp;G to ditch Duracell batteries amid earnings drop ","news"
"996","Suspicious envelopes sent to foreign missions in Istanbul ","news"
"997","MT @EwanMah: @simona_halep wins 2nd set 6-3 v @AnaIvanovic. Halep through to top 4 with @serenawilliams! @WTAFinalsSG ","news"
"998","Batteries not included, as @ProcterGamble dumps @Duracell over poor earnings ","news"
"999","MT @EwanMah: @simona_halep only needs a set to seal top spot and knock @AnaIvanovic out! @WTAFinalsSG ","news"
"1000","Suspicious packages sent to Canadian, Belgian and German consulates in Istanbul ","news"
"1001","MT @EwanMah: If @AnaIvanovic beats @simona_halep in straight sets, she goes thru and knocks Serena out! @WTAFinalsSG ","news"
"1002","Britain's Queen Elizabeth sends first tweet ","news"
"1003","Mali confirms first Ebola case, monitors 43 for virus ","news"
"1004","MT @EwanMah: How abt that?@AnaIvanovic wins 1st set 7-6 v @simona_halep She was 4-2 down at one pt @WTAFinalsSG ","news"
"1005","5 more served conditional warnings for taking part in a protest march led by Han Hui Hui ","news"
"1006","2 charges for Roy Ngerng, Han Hui Hui on Monday: Public nuisance, holding a demo without approval ","news"
"1007","EU raises $US1.3b to fight #Ebola in W Africa; money to go on research, staff and facilities ","news"
"1008","At least 824,000 displaced by Ukraine conflict: UN ","news"
"1009","Risk of Ebola in Singapore can't be ruled out: Health Ministry ","news"
"1010","Mapletree Commercial Trust reports 8.8% rise in Q2 net property income ","news"
"1011","Time to go home: Tung Chee-hwa to protesters ","news"
"1012","MOH says risk of Ebola in Singapore cannot be ruled out. @TTSH has formed an Ebola SWAT team ","news"
"1013","PROTESTS AT A PEAK: #OccupyCentral movement hits new heights with hilltop banner ","news"
"1014","British woman, 24, dies after botched liposuction in Bangkok; plastic surgeon arrested ","news"
"1015","Jetstar Asia takes over Valuair flights to Indonesia ","news"
"1016","Arrested yesterday: 2 debtors who became runners for loanshark syndicates (File photo) ","news"
"1017","Sweden calls off week-long naval hunt, but mystery lingers over ‘phantom’ submarine ","news"
"1018","RT @EwanMah: @MariaSharapova drops 2nd set v @ARadwanska to tumble out of tournament. @WTAFinalsSG #WTAFinals ","news"
"1019","Beijing’s election plan for HK is “genuinely democratic”: Ex-leader Tung Chee-hwa ","news"
"1020","Goodbye, Valuair: @Jetstar_Asia will take over all VF flights to Indonesia from Sunday ","news"
"1021","RT @EwanMah: @MariaSharapova v @ARadwanska 7-5, 5-5 Tough one! #Radwanska was 4-1 down at one point #WTAFinals ","news"
"1022","FROM BATSUIT TO TURTLENECKS: Do you think Christian Bale will make a good Steve Jobs? ","news"
"1023","Toyota shares rise on record profit report ","news"
"1024","President Tony Tan visits world of Shaun the Sheep, Wallace and Gromit ","news"
"1025","Anwar’s defamation suit against Malaysia minister to be heard May 7 ","news"
"1026","SAP to open new innovation centre in Singapore by end-2014 ","news"
"1027","Flight departs for North Korea despite Ebola tour ban ","news"
"1028","Singapore President Tony Tan visits the world of @shaunthesheep, Wallace and Gromit @aardman ","news"
"1029","Flight departs for N Korea despite apparent ban on foreign tourists due to #Ebola ","news"
"1030","Software giant @SAP marks 25 years in APAC with new innovation centre in Singapore by end-2014 ","news"
"1031","New technique allows hearts that have stopped beating to be transplanted ","news"
"1032","RT @EwanMah: Alarm just went off. Great professionalism from @MariaSharapova, @ARadwanska to keep playing #WTAFinals ","news"
"1033","SPRING Singapore sets up appeal panel to help advise on applications for Capability Development Grant ","news"
"1034","Rugby: Japan pips Singapore for spot in Super Rugby ","news"
"1035","RT @EwanMah: @MariaSharapova takes the 1st set v @ARadwanska 7-5! @WTAFinalsSG #WTAFinals ","news"
"1036","JUST IN: @SanzarTRC decides to award Japan with 18th team spot in Super Rugby, over Singapore ","news"
"1037","Foreigners planning to marry Singaporeans can expect a shorter wait for a Long Term Visit Pass ","news"
"1038","Vehicle theft at Serangoon Ave 4: Suspect arrested 5 days after a police report was lodged ","news"
"1039","More anti-Pyongyang leaflets to be launched across border, despite threats of retaliation ","news"
"1040","JUST IN: New measures to help foreigners who wed S'poreans include fewer hurdles to employment ","news"
"1041","#IslamicState’s Kobane assault stalls due to US-led air strikes ","news"
"1042","Manufacturing output contracts 1.2% in September as biomedicals slide ","news"
"1043","To defray high initial costs, a compulsory monthly top-up component was introduced ","news"
"1044",".@Singtel starts sale of #iPadAir2, #iPadMini3 today ","news"
"1045","EU agree to cut greenhouse gas emissions by 40% - compared to 1990 levels - over 16 years ","news"
"1046","Service quality plays key role in encouraging S'poreans to use public transport: Lui Tuck Yew ","news"
"1047","Contractor who failed to register his firm for GST for 4 years must now cough up S$509,000 ","news"
"1048","More than 1,700 bombs, missiles used in US-led battle against #IslamicState ","news"
"1049","Marina Bay Cruise Centre announces upgrades, having made headlines due to passenger bottleneck ","news"
"1050","IDA subsidiary Assurity will work with NYP (@nyptweets) to grow local IT security talent pool ","news"
"1051","Around the moon in eight days: China launches space mission with unmanned probe ","news"
"1052","“#Ebola is an extremely hard disease to contract"": New York Mayor says no cause for alarm ","news"
"1053","Christian Bale gets coveted turtleneck, will play #Apple co-founder Steve Jobs in biopic ","news"
"1054","@bavaaneh @comradew0lf Yikes! Thanks for pointing that out - we've made the needed correction.","news"
"1055","China, Malaysia and Singapore among 21 countries to sign an MoU to establish the Asian Infrastructure Investment Bank ","news"
"1056","#OttawaShooting gunman was planning to travel to Syria: Police ","news"
"1057","Mali confirms first case of #Ebola after girl tests positive upon return from Guinea ","news"
"1058","Goal of the season, surely? Watch the video of @Coco_Lamela's outrageous ""rabona"" goal here: ","news"
"1059","JUST IN: Office space prices rose in Q3, but retail space prices slid in the same period: URA ","news"
"1060","HDB resale prices down 1.7% on-quarter in Q3; resale transactions up 2.8%: @Singapore_HDB ","news"
"1061","#IslamicState is world’s richest, most financially sophisticated terror group: US officials ","news"
"1062","Doctor tests positive for #Ebola in New York after returning from Guinea: @nytimes ","news"
"1063","Prices of private homes in Q3 fell 0.7% from Q2 – marking a full year of declines ","news"
"1064","BREAKING: Doctor in New York City tests positive for #Ebola - @nytimes ","news"
"1065","Canada hails sergeant-at-arms for ending gunman's rampage in #OttawaShooting ","news"
"1066","""Harry, let's take a photo by the roses"" – Mrs Lee to Mr Lee Kuan Yew on Valentine's Day 2008 ","news"
"1067","S'pore slams @wwfsg report which says it has the 7th-largest ecological footprint @TODAYonline ","news"
"1068","Japan's Supreme Court issues ruling to protect pregnant employees from discrimination ","news"
"1069","Lee Kuan Yew's Battle for Merger talks, Part 7: Why did the British mislead the Communists?","news"
"1070","Malaysian envoy to be extradited on NZ sex charge ","news"
"1071","Amazon stock plunges as loss widens ","news"
"1072","Christian Bale to play Apple's Steve Jobs ","news"
"1073","Canadian shooter planned to go to Syria: Police ","news"
"1074","Yen sinks as forex traders switch to euro, greenback ","news"
"1075","Football: Lamela's goal sparks Spurs win, Everton held by Lille ","news"
"1076","'Cloud' lifts Microsoft earnings above expectations ","news"
"1077","US stocks surge on earnings; Nasdaq +1.6% ","news"
"1078","Tennis: Federer reaches Swiss Indoors quarter-finals ","news"
"1079","Ebola still of 'great concern' in west Africa epicentre: WHO ","news"
"1080","EU leaders struggle for 'difficult' climate deal ","news"
"1081","Oil rebounds on German, Chinese data; Saudi cutback news ","news"
"1082","Football: Everton held by Lille but remain top in Europa League ","news"
"1083","Canada faces militant threat after home-grown attacks ","news"
"1084","Motor Racing: Mikkelsen takes Rally of Spain super-special ","news"
"1085","Japan top court issues pregnant women protection ruling ","news"
"1086","GM profit drops on weakness in Europe, South America ","news"
"1087","Tennis: Williams sisters get written apology from Russian boss ","news"
"1088","MT @ByFarisMokhtar: India's @MirzaSania on court for her doubles match! ","news"
"1089","“I want genuine universal suffrage”: Banner hung from landmark #HongKong cliff ","news"
"1090","MT @EwanMah: 205km/h! @serenawilliams registers fastest serve @WTAFinalsSG @ChannelNewsAsia ","news"
"1091","MT @ByFarisMokhtar: Serena wins 6-1, 6-1 ","news"
"1092","No more tears? UK to review tear gas sales to #HongKong after its use on #OccupyHK protesters ","news"
"1093","China’s Shanghai Free Trade Zone: Dud or over-hyped? Between The Lines, 11pm SG/HK","news"
"1094","Teen trapped in Hougang flat by fire ","news"
"1095","Japan’s bullet train turns 50 and is poised for overseas expansion. @MichiyoCNA reports: ","news"
"1096","Lee Kuan Yew visiting an exhibition on his #BattleForMerger talks.Videos of speeches here: ","news"
