"","user","type"
"762","Birds colour-match their nests for camouflage ","technology"
"763","Good news, Star Trek fans. THE HOLODECK EXISTS. (in prototype form, but still) ","technology"
"764","Amazing, early 20th century photo-micrographs ","technology"
"765","@brazoscole Thanks for reading. Some free samples and single issues are available in our apps.  Give them a try  ","technology"
"766","Location, location. These 3 discovered the brain's SatNav. And have won a #Nobel for it ","technology"
"767","Writers thinking about using forensic science in their work might want to read this ","technology"
"768","Plants are out of date. UPGRADE THEM! (is this a good idea?) #supercrops","technology"
"769","John O?€?Keefe and the Mosers share the Physiology #Nobel - Quite a lot of stuff in our archive about them, e.g. ","technology"
"770","Grid cells win the medicine #Nobel. Cells that help you find your way: ","technology"
"771","Six ways a science degree will change your life (Sponsored by Monash University)","technology"
"772","This is not good. The world is warming even faster than we thought ","technology"
"773","Curious goings-on at the heart of the atom may be pointing to a new force of nature: ","technology"
"774","Climate change may be making Australia to hot for humans. Join us in Sydney on 28 Oct to discuss with the experts: ","technology"
"775","What the big European Medicines Agency drug-data ruling means for pharma firms and you ","technology"
"776","New super-detailed weather forecast map shows US of fire and ice ","technology"
"777","How big is a proton? Find out why it's harder to answer that question than you might think at ","technology"
"778","Today on New Scientist: knotty solutions for physics, 3D printing's high-street future, glaciers on Mars and more ","technology"
"779","Want to avoid bad blackouts? Build a power grid that looks like a snowflake ","technology"
"780","Vast glaciers carved out Valles Marineris, the Martian Grand Canyon ","technology"
"781","@MalwenGoch Thanks for subscribing! It should arrive on Friday normally.  Our digital issues are available on Thursday.","technology"
"782","Top tips for hacking your attention span ","technology"
"783","Digital subscribers can download this week's issue now via the App Store or Google Play.   Thanks for reading! (2/2)","technology"
"784","UK print subscribers: you should receive your magazine on Saturday or Monday this week due to a delivery delay (1/2)","technology"
"785","Knots go beyond shoelaces and headphone cords, to more slippery contexts like water and fields ","technology"
"786","The first map that shows how HIV exploded into a global killer ","technology"
"787","The public wants 3D printers - just not at home ","technology"
"788","How to win by a neck (clue: the sauropods have an unfair advantage) ","technology"
"789","How the sauropod got its neck (some were 15 metres long) ","technology"
"790","From the sun's excess heat to fluid turbulence, knots could unravel many mysteries In-depth: ","technology"
"791","Today on New Scientist: fine-tune your mind, monster neutrino, Watson supercomputer turns heart doctor and more ","technology"
"792","It might have been the cerebellum's growth spurt that turned monkeys into humans ","technology"
"793","Stem cells are getting serious: they're being tested to treat heart failure and diabetes ","technology"
"794","Read my lips. One day we might be unlocking our computers with a word ","technology"
"795","#TBT This computer brain cover is from 1987. Today, we bring you our user's guide to the mind ","technology"
"796","iPhone 6 not big enough? Sonic sensors let you control gadgets with table taps ","technology"
"797","Total strangers can act as personal shoppers for you online ","technology"
"798","@lithospheric Thanks for your help and for reading!   It is very much appreciated.","technology"
"799","@KanicaWithC Our digital subscription package provides the best value &amp; reliability. For help ","technology"
"800","@copious_kim Amazing! Thanks for reading and sharing!","technology"
"801","Why are deserts where they are? And where will they go in future? Read more: ","technology"
"802","Watson supercomputer looks for heart disorders that could cause sudden cardiac arrest ","technology"
"803","Ebola case in the US highlights risk to other nations ","technology"
"804","Monster neutrino hints at a giant particle accelerator at the centre of our galaxy ","technology"
"805","7 ways to fine-tune your brain - and the perfect times of day to try them. ","technology"
"806","Has little Albert, the baby used in a notorious fear experiment, been found?","technology"
"807","Look inside a giant supernova that seeded the universe ","technology"
"808","""Climate change can seem insuperable, but take heart: we've changed the climate once already."" Advice from #nslive ","technology"
"809","World's smallest microphone is just one molecule ","technology"
"810","Faster winds are driving climate change. Hello, Hadley cells ","technology"
"811","Today on New Scientist: marshmallow psychologist, wildlife halved in 40 years, chimp social network, longevity drugs ","technology"
"812","Today's #nslive asks if wild weather is caused by climate change. Time to become an Instant Expert on extreme weather ","technology"
"813","The human mind: A user's guide. Plus: everyday longevity drugs, the promise of knots and more ","technology"
"814","Blood test to predict how you'll recover from an operation ","technology"
"815","@KevinAirs442 We can honor initial error rate and send you a thank you for your time and effort in reporting. Thanks for reading (2/2)","technology"
"816","@KevinAirs442 Our apologies for the error and thanks for flagging. Please send your details to kim.karman at (1/2)","technology"
"817","Everyday drugs could give you 10 years of extra life ","technology"
"818","@MikevwoodsMike This is the article: ","technology"
"819","Thinking of giving up #gluten? Are humans even meant to eat #wheat? Read this first: ","technology"
"820","@squaregoldfish If you are experiencing a particular error with a page, could you kindly send us a link? Thanks again for the feedback.","technology"
"821","@squaregoldfish Thanks for reading. Our website gets updated Wednesday, issue out on Thursday. Past issues are here ","technology"
"822","@nosyreporter Thanks for the feedback. This article is free to read - you just need to log in.","technology"
"823","Wild weather and climate change! New Scientist's live event is tonight at Conway Hall, London. Limited tickets on the door, from 6pm.","technology"
"824","@ValAndreaWay What a great cousin! Thanks for reading.","technology"
"825","@LucyRebeccaHill Single issues of New Scientist are also available in app to download. Give it a try here ","technology"
"826","@UnhingedBlah Try downloading our apps - we have some free sample issues in there to try.  Thanks for reading! ","technology"
"827","@alfabravoteam Our apologies. Here's the correct link ","technology"
"828","@snotskie Our apologies. Here's the correct link ","technology"
"829","@alex__dorman Our apologies. Here's the correct link ","technology"
"830","@GothamKnowledge Our apologies. Here's the correct link ","technology"
"831","@philippineDR3AM Our apologies. Here's the correct link ","technology"
"832","@DarnellKelly Our apologies. Here's the correct link ","technology"
"833","@slirbacvek Our apologies. Here's the correct link ","technology"
"834","@_Polyhymnia Thank you.  We don't have a poster sized image available, but the correct article link can be found here ","technology"
"835","@raka_paul99 Our apologies. Here's the correct link ","technology"
"836","@cain_rob Our apologies. Here's the correct link ","technology"
"837","Proton puzzle at the heart of the atom may point to a new force of nature (link corrected) ","technology"
"838","@GeoffWatson7 Our apologies. Here's the correct link ","technology"
"839","@WHEbe60165 Our apologies. Here's the correct link   ","technology"
"840","@GeoffWatson7 @WHEbe60165 @cain_rob @raka_paul99 @slirbacvek @GothamKnowledg @snotskie @alfabravoteam Thx - we'll retweet w the correct link","technology"
"841","Proton puzzle: curious goings-on at the heart of the atom may point to a new force of nature ","technology"
"842","Rogue winds swept humans to last uninhabited islands, including New Zealand and Easter Island ","technology"
"843","The world's wildlife population has halved in just 40 years ","technology"
"844","This social network for chimps shows how new ideas catch on ","technology"
"845","The population is ageing and we're not prepared. Here's the best countries to be old in ","technology"
"846","Earth gets a new companion, asteroid 2014 OL339, for trip around sun ","technology"
"847","@BetterBuyLocal Thanks for adding us!","technology"
"848","Today on New Scientist: what dolphins really think, being yourself online, how Hong Kong protesters network and more ","technology"
"849","Green tumour cells crawl toward red blood vessels in this video of #cancer metastasis. More: ","technology"
"850","Hong Kong protesters turn to FireChat mesh networking app to organise ","technology"
"851","Earth's navel: Stare into an eye-wateringly BIG hole ","technology"
"852","Sunflower solar harvester provides power and water ","technology"
"853","Did we come out of a cactus or a bush? Or are we all South Africans? ","technology"
"854","We need to start loving #dolphins for the animals they are - not thinking, smiling people of the sea ","technology"
"855","@_mlDev We're sorry to hear that.  If you could kindly email marketing@newscientist.com with your details we can update your preferences.","technology"
"856","Is it a human? Is it an ape? All about the crazy mixed-up hominin Australopithecus sediba at ","technology"
"857","The type of eruption just seen in Japan could happen at many dormant volcanos ","technology"
"858","#Dolphins are hyped as the 2nd-smartest Earthlings, but may just be average mammals w/ good PR ","technology"
"859","Meet the strange ape that's rewriting our family tree. All about Australopithecus sediba at ","technology"
"860","Today on New Scientist: electronics-frying space invaders, Japanese volcano, Arctic impact on jet stream and more ","technology"
"861","Japan's Ontake eruption was practically undetectable in advance ","technology"
"862","@ClaireMTPearson Thanks for your interest in New Scientist and for reading our book series. Enjoy!","technology"
"863","@ClaireMTPearson Guess what the next New Scientist book is entitled?  Out November 6th, available for pre-order now ","technology"
"864","How do the world's top physicists deal with believing we live in a mind-bending multiverse? ","technology"
"865","@ClaireMTPearson Have a feeling you're going to love our next book. You can pre-order 'Question Everything' now!! ","technology"
"866","Climate change threatens to choke the flow of coffee. Is this the end of our favourite drink? #InternationalCoffeeDay ","technology"
"867","Why we weren't ready for ebola, from the man who first discovered it ","technology"
"868","@JamesKTaylor Thanks for reading. Check us out on the web at too.  Enjoy!","technology"
"869","It's #InternationalCoffeeDay people! Here's how your cup of joe will taste in the future: ","technology"
"870","@sannapeden Artist is Richard Wilkinson It would be best to contact him directly for any prints. Thanks for reading.","technology"
"871","@LauraBailey1508 The article is and was written by @catbrahic  Best of luck in your studies and thanks for reading.","technology"
"872","@ProfEdCopeland Thanks for spotting and the feedback. Our customer team can help find the best offer for you ","technology"
"873","@sannapeden Do you know the issue/ context of the article? Our archives can be explored here We'll try to find too.","technology"
"874","""There is nothing symbolic about this."" India's Mars triumph signals a rising space power ","technology"
"875","Crazy weather traced to melting Arctic's impact on jet stream ","technology"
"876","Six ways a science degree will change your life (Sponsored by Monash University)","technology"
"877","Win a kids' coding starter kit with 3 amazing gadgets, including a Kano! Log in free to enter: ","technology"
"878","The need for faster, smaller gadgets means they are becoming more vulnerable to cosmic rays ","technology"
"879","Oh give me a rainbow home where the buffalo roam ","technology"
"880","India, a rising space power with Mars already in the bag, is now looking elsewhere in the solar system ","technology"
"881","Magnets are being tested to mop up cancer cells that surge into the blood during surgery ","technology"
"882","Cosmic rays threaten to bring chaos to our electronic world. Is there anything we can do? ","technology"
"883","Today on New Scientist: traps to arrest spreading cancer, cosmic inflation, India's tiger-trading hotspots and more ","technology"
"884","#Mangalyaan and #MAVEN have sent back their first pics of Mars ","technology"
"885","@wildmother2 @SusanFelicity Good choice. I expect Tank Girl reads New Scientist too.","technology"
"886","Toxic, addictive, deadly? We put sugar on trial to reveal the truth behind the hype: ","technology"
"887","@glcranston @Tesco @EverydaySexism  New Scientist is a news weekly magazine. We want science and technology to be of interest to everyone.","technology"
"888","Four ways you can see the #multiverse in our everyday world #quantumweirdness","technology"
"889","Our interview about the indoor microbiome will make you see your colleagues in a new light. ","technology"
"890","Equip yourself for Australia's shaky jobs market with a science degree. ","technology"
"891","Suddenly the best evidence for cosmic inflation is either nothing, or evidence against it ","technology"
"892","Hotspots in India's tiger-trading network revealed ","technology"
"893","Four ways you can see the multiverse in our everyday world ","technology"
"894","Cosmic inflation is dead, long live cosmic inflation! #BICEP2 ","technology"
"895","Spacecraft duo beam back their first Mars snaps ","technology"
"896","Up to half of Earth's water is older than the sun ","technology"
"897","Tumour traps: How to arrest cancer as it spreads ","technology"
"898","Microbes live here too, you know. Jessica Green has some advice for architects ","technology"
"899","@elessthanthree Your feedback is appreciated.  We can send you a 'thank you' if you send your address to marketing at ","technology"
"900","@elessthanthree Sorry about that.  We have iOS and Android apps available if that helps  Or check out Zinio?","technology"
"901","Today on New Scientist: how to live in the multiverse, gaming bots, modified aubergines and India, and more ","technology"
"902","The fascinating and tragic life of Hugh Everett, the man who gave us the multiverse ","technology"
"903","A humble GM aubergine (or eggplant or brinjal) could revolutionise farming in India ","technology"
"904","This craze for CubeSats could create a space debris catastrophe #IAC2014 #Gravity ","technology"
"905","@SergeAhmed What about time travellers from the future who are reading our twitter stream and have the technology? We can't be too careful.","technology"
"906","It's time for YOU to play the role of Schr??dinger's cat. (WARNING: Do NOT really do this.) ","technology"
"907","@hammersley Thanks for flagging. You can activate your subscription here Our team can help too ","technology"
"908","@Sprakeloos If you have any questions, our customer care team is available to help you here Thanks again for reading","technology"
"909","@Sprakeloos Thanks for your interest. Our website allows full access to our archive. Apps for smartphones package by issues to download.","technology"
"910","Moving offices? You need to use chat-trackers to see how your team really interact ","technology"
"911","The vagus nerve underpins health and happiness - you can think it into working better ","technology"
"912","Every choice spawns a multitude of universes. Does anything matter when everything happens? ","technology"
"913","Buttonmasher: Super-smart gaming bots learn from how we play ","technology"
"914","Wireless charger powers up iPhone in your pocket (make sure it isn't one of the bendy ones) ","technology"
"915","Reasons to be optimistic about NY climate summit ","technology"
"916","Air-chaeological drones looks beneath the soil in search of buried treasures in ancient Greek cities ","technology"
"917","Choose your own destiny in the multiverse And should I care about my other quantum selves? ","technology"
"918","Thanks to the vagus nerve, you can meditate your way to better health. Find out more at ","technology"
"919","How to live in the multiverse: Does anything matter when everything happens? Plus much more ","technology"
"920","Today on New Scientist: world wakes up to Ebola, breast pump hackathon, bold pledges from climate summit and more ","technology"
"921","Breast pumps suck - and not in a good way. We see if a new one be invented in 24 hours. ","technology"
"922","The 7 evolutionary steps that gave us the power of imagination ","technology"
"923","?€?Unprecedented?€? climate summit leads to bold pledges #Climate2014","technology"
"924","Deep voice, fat salary. Find out why at ","technology"
"925","Sex inequality in science is finally being tackled. More FEMALE MICE in labs!  ","technology"
"926","@richarddjordan We have your details and a customer care representative will be updating your subscription and corresponding shortly.","technology"
"927","@richarddjordan Our apologies for the poor experience. Your feedback is important to us as we work towards improving our site and processes.","technology"
"928","The tree with mega-bloat #baobab","technology"
"929","Can you guess a person's age from their voice? Take our quiz to find out: ","technology"
"930","A window physicists peered through when developing the first atomic bombs is being auctioned ","technology"
"931","World wakes up to Ebola as cases set to top 1 million ","technology"
"932","Your voice affects everything from sex appeal to bank balance. But it can misrepresent you too ","technology"
"933","A chimp can think of things that aren't there, like hidden food. But can it imagine a unicorn? ","technology"
"934","Today on New Scientist: powerful aliens inhabiting you, Mongolia's dinosaur repo woman, Aristotle and more ","technology"
"935","Naomi Klein's new book. Powerful. Impassioned. But does her climate narrative really change anything? ","technology"
"936","For sale. Nuclear window used in Manhattan Project. Quite clean, not radioactive.  ","technology"
"937","Mitochondria are in every multi-celled life form - and do far more than you learned in biology ","technology"
"938","Meet the woman who saved Mongolia's stolen dinosaurs ","technology"
"939","UN Sustainable Development Goals, in force from 2016, should focus on cutting premature deaths ","technology"
"940","Private flights may make the International Space Station more expensive ","technology"
"941","We know how to make Scotland healthier and happier. Join us in Glasgow on 12 November: ","technology"
"942","A US probe has entered Martian orbit and an Indian craft is close behind Video &gt; ","technology"
"943","Humans are not to blame for the 100 years of warming over north-west US ","technology"
"944","Could your mitochondria help you fight ageing? ","technology"
"945","The north-west US has experienced 100 years of warming, but it seems human-caused climate change isn't to blame ","technology"
"946","They have a hand in everything from ageing to obesity. Meet the aliens inside you: ","technology"
"947","Is it time for psychology and economics to go quantum? ","technology"
"948","Today on New Scientist: free will and brain scans, New York climate march &amp; talks, ancient Mesopotamian pop and more ","technology"
"949","Lonesome George is back. Sort of. ","technology"
"950","Spacecraft will probe how Mars lost its air Read more: ","technology"
"951","UN climate change talks in NYC: what you need to know #Climate2014 ","technology"
"952","DRONE ZONES - now open for business in America's air space ","technology"
"953","Excited by the news that quantum teleportation has occurred over 25 kms? It happened over 143 km in 2012 ","technology"
"954","Ripples from dawn of creation have just vanished in a puff of dust #Planck ","technology"
"955","Imaginary friends may offer the same kind of support as real friends and family. ","technology"
"956","@impworks @STGGrant  This week's cover story is and our special is Thanks for reading.","technology"
"957","""You have to keep up hope"": @catBrahic joins the climate change protesters in NYC ","technology"
"958","The worrying graph that shows we're on course for extreme global warming #Climate2014 ","technology"
"959","US probe MAVEN enters Mars orbit, while India's MOM craft is close behind ","technology"
"960","US #Maven probe enters Mars orbit - and an Indian spacecraft is close behind ","technology"
"961","Ultimate golden oldies: reverse-engineering the pop songs of the 2nd millennium BC ","technology"
"962","RT @sandsyLad94: Did you know that 'Paracosms' is the term for imaginary worlds? ","technology"
"963","NASA?€?s #MAVEN (Martian Atmosphere and Volatile Evolution) spacecraft has successfully entered Martian orbit! More soon.#Mars","technology"
"964","This iPhone accessory measures your glasses prescription and could bring eyecare to where it is most needed ","technology"
"965","Predicting earthquakes may soon involve testing the chemical make-up of underground water ","technology"
"966","A special ingredient in coolants could slash fuel bills and stir up an energy revolution ","technology"
"967","Eating insects: good for you, good for the environment. Is that enough to switch yuck for yum?","technology"
"968","Bug Mac and flies: Are insects really food's future? Not the way you might think ","technology"
"969","Daydream believers: Is imagination our greatest skill? ","technology"
"970","The most detailed map ever of the Milky Way includes 219 million stars. This is just a slice ","technology"
"971","Free will persists (even if your brain made you do it) ","technology"
"972","Would you eat insects? These chefs mean to make you try. Read our full in-depth article at ","technology"
"973","Today on New Scientist: 6 solar strangenesses, US drone zones open, Ig Nobels, Apple Watch, ants vs spiders and more ","technology"
"974","@Yente_Espinosa @Tesco No. New Scientist is a news weekly magazine. We want science and technology to be of interest to everyone.","technology"
"975","Video chat in US jail shelved over concerns for inmates ","technology"
"976","Scotland's scientists breathe easier after No vote #indyref #scienceFTW","technology"
"977","Epilepsy gives woman compulsive urge to write poems #poetry","technology"
"978","Who needs fingers? A new gaze-tracker lets you connect to gadgets with a glance ","technology"
"979","Bulldog ants are fighting dirty in a vicious turf war with spiders #zoologger ","technology"
"980","Last week's Apple Watch launch is just the latest step towards ubiquitous self-monitoring ","technology"
"981","Murderer and rapist Frank Van Den Bleeken has won the right to die: should this be allowed?","technology"
"982","Tick tick boom, the Earth spits out a moon. Full in-depth article at ","technology"
"983","@cawhitworth Well spotted! :) Wish we could include it with every story...","technology"
"984","@milesffc Congratulations! Thanks for reading and writing in.","technology"
"985","Jesus on toast! Frictional coefficient of banana skin, dog urination studies. It's the #IgNobel awards ","technology"
"986","Equip yourself for Australia's shaky jobs market with a science degree. ","technology"
"987","Scientists think the sun's polarity is in the process of reversing right now ","technology"
"988","Our sun's long-lost sibling, formed in the same cloud as our solar system, lives in Hercules ","technology"
"989","Global population may boom well beyond the year 2050 ","technology"
"990","Rainy, with a chance of tornadoes, on the sun Read more about our mysterious home star: ","technology"
"991","Did a nuclear time bomb deep inside the young Earth tear the planet apart? In-depth article: ","technology"
"992","Imagination: Why we spend so much time exploring realities that don't exist ","technology"
"993","Today on New Scientist: why imagination matters, artificial sweeteners and health, cross-species baby criest and more ","technology"
"994","Just one day left to win a VIP museum trip to London including 4* hotel. Log in free to enter: ","technology"
"995","We're getting closer to a quantum internet. And that'll be good for security. ","technology"
"996","Tiny changes in air temperature could power the sensors of the future ","technology"
"997","A mother deer will rush to help if she hears a baby seal - or even human baby - cry. Why? ","technology"
"998","Scotland should look to Estonia and Iceland if they decide to go it alone #indyref","technology"
"999","What would Scottish independence mean for science? #indyref","technology"
"1000","It is 2062, and the youngest people now voting in Scotland's #indyref are now approaching retirement... ","technology"
"1001","Bask in the green beauty of the aurora borealis lighting up a glacial lagoon  ","technology"
"1002","@sportmednews Yes we do.  Thanks for reading","technology"
"1003","Psychedelic bird droppings? No: colliding galaxies, 40 to 600 million light years from Earth  ","technology"
"1004","@JamieBellinger May we suggest that you give our app or digital subscriptions a try?   Thanks for reading!","technology"
